{
  "id": "calamity-galloping-inferno-double-saddle-2026-09-23",
  "findingType": "relationship_signal",
  "title": "Calamity's saddle trigger repeats, making two copies and doubling an ETB",
  "summary": "A budget mono-red build is organised around the second half of the attack trigger, which runs the copy process twice rather than once. Because the commander has haste it can be cast, saddled with a cheap enter-the-battlefield creature and attack on the same turn, doubling that trigger immediately for mana, cards, removal or damage. The copy only happens for a nonlegendary saddler, which pushes the creature base toward cheap repeatable enter triggers instead of marquee legends.",
  "source": {
    "name": "Archidekt",
    "type": "primer",
    "url": "https://archidekt.com/decks/26597078",
    "creator": "Panzer-MTG",
    "resourceDepth": "primer"
  },
  "publishedAt": "2026-09-20",
  "observedAt": "2026-09-23T07:10:00.000Z",
  "commanders": [
    {
      "name": "Calamity, Galloping Inferno",
      "slug": "calamity-galloping-inferno"
    }
  ],
  "cards": [
    {
      "name": "Emrakul's Hatcher",
      "slug": "emrakul-s-hatcher"
    },
    {
      "name": "Meteor Golem",
      "slug": "meteor-golem"
    },
    {
      "name": "Combat Celebrant",
      "slug": "combat-celebrant"
    },
    {
      "name": "Hoarding Dragon",
      "slug": "hoarding-dragon"
    },
    {
      "name": "Panharmonicon",
      "slug": "panharmonicon"
    },
    {
      "name": "Seize the Day",
      "slug": "seize-the-day"
    },
    {
      "name": "Flameshadow Conjuring",
      "slug": "flameshadow-conjuring"
    }
  ],
  "evidence": {
    "strength": 0.6,
    "independentSourceCount": 1,
    "conversationDepth": "reasoned",
    "communityReasoned": true,
    "tested": false,
    "notes": [
      "The primer names the exact rules clause the build hangs on and explains why haste makes it work the turn the commander lands.",
      "From a channel that specialises in overlooked commanders, which is the targeting signal docs/SOURCES.md describes."
    ],
    "alternatives": [
      {
        "name": "Saddling with legendary bombs",
        "status": "rejected",
        "reason": "The trigger only copies a nonlegendary creature that saddled it, so a legendary saddler produces nothing at all."
      },
      {
        "name": "Building it as a go-wide token board",
        "status": "rejected",
        "reason": "The copies are sacrificed at the beginning of the next end step, so value has to be banked the same turn rather than accumulated."
      }
    ]
  },
  "tags": [
    "arch-clones",
    "arch-tokens",
    "band-1000-2000",
    "ci-r",
    "mech-etb-doubling",
    "mech-saddle",
    "recheck-90d",
    "seed-2026-09"
  ],
  "popularity": {
    "edhrecRank": 1219,
    "deckCount": 1793,
    "asOf": "2026-09-22"
  }
}
