{
  "id": "grismold-the-dreadsower-lure-deathtouch-2026-10-22",
  "findingType": "deep_dive_resource",
  "title": "Grismold hands every player a blocker, so a Lure-plus-deathtouch attack turns those gifts into a one-sided wipe that grows him",
  "summary": "Grismold gives each player a 1/1 Plant at your end step and gets a +1/+1 counter whenever a creature token dies, which normally reads as group hug with a small payoff. This build leans into the gift: Lure effects force every opposing creature to block one attacker, deathtouch means a single point of damage kills each blocker, and Grismold's own trample carries the rest through. Every Plant that dies grows him, and opponents who sacrifice their tokens to dodge it grow him too. Payoffs for mass blocks (card draw, theft, token makers) and Trailblazer's Torch extend the trick past the commander. The Archidekt primer explains each piece; an EDHREC contest put it among October's three finalists.",
  "source": {
    "name": "Grismold goes fishing (Archidekt primer)",
    "type": "primer",
    "url": "https://archidekt.com/decks/27417233/grismold_goes_fishing",
    "creator": "foldedboats",
    "resourceDepth": "primer"
  },
  "publishedAt": "2026-10-14",
  "observedAt": "2026-10-22T07:40:00.000Z",
  "commanders": [
    {
      "name": "Grismold, the Dreadsower",
      "slug": "grismold-the-dreadsower"
    }
  ],
  "cards": [
    {
      "name": "Lure",
      "slug": "lure"
    },
    {
      "name": "Basilisk Collar",
      "slug": "basilisk-collar"
    },
    {
      "name": "Touch of Moonglove",
      "slug": "touch-of-moonglove"
    },
    {
      "name": "Infiltration Lens",
      "slug": "infiltration-lens"
    },
    {
      "name": "Trailblazer's Torch",
      "slug": "trailblazers-torch"
    },
    {
      "name": "Death Tyrant",
      "slug": "death-tyrant"
    },
    {
      "name": "Vicious Battlerager",
      "slug": "vicious-battlerager"
    }
  ],
  "evidence": {
    "strength": 0.55,
    "independentSourceCount": 2,
    "conversationDepth": "reasoned",
    "communityReasoned": true,
    "tested": false,
    "notes": [
      "Oracle text checked on Scryfall 2026-10-22: Commander 2019, trample, each player makes a 1/1 Plant at your end step, and any creature token dying (anyone's) puts a +1/+1 counter on him.",
      "The primer explains why the pieces fit rather than listing them: deathtouch makes each forced blocker cost one point of damage, trample pushes the rest through, and sacrificing the Plants to escape a Lure attack still feeds Grismold.",
      "Corroboration is editorial, not results: the deck is one of three finalists in EDHREC's October deckbuilding contest (Dana Roach, 2026-10-21, https://edhrec.com/articles/octobers-deckbuilding-contest-finalists-vote-now/). No games are reported.",
      "Range is the case for filing: the Lure-deathtouch-trample package ports to any trampling commander, and Grismold also supports aristocrats and +1/+1-counter shells off the same token-death trigger. Lure is not among his EDHREC themes.",
      "Honest limit: the builder admits running every workable Lure including some at awkward mana values, so the card quality is uneven; the interaction is the find, not the list."
    ],
    "corroboratingSources": [],
    "alternatives": [
      {
        "name": "Group hug tokens",
        "status": "rejected",
        "reason": "The listed default treats the Plants as a political gift; this build treats them as ammunition."
      },
      {
        "name": "Deathtouch plus trample",
        "status": "supporting",
        "reason": "Deathtouch lets a trampler assign one damage per blocker and the rest to the player, so a forced mass block becomes a wipe and a hit."
      }
    ]
  },
  "tags": [
    "ci-bg",
    "arch-tokens",
    "arch-voltron",
    "mech-lure",
    "mech-deathtouch",
    "band-500-1000",
    "recheck-90d"
  ],
  "popularity": {
    "edhrecRank": 940,
    "deckCount": 2743,
    "asOf": "2026-10-21"
  }
}
