[
  {
    "id": "niv-mizzet-ghost-counsel-life-neutral-draw-2026-09-24",
    "findingType": "emerging_brew",
    "title": "Confessor makes Niv's draw life-neutral, so Skirge Familiar's discard pays for itself",
    "summary": "Reality Fracture's Orzhov Niv-Mizzet converts any life gained into that many cards, paid for with the same life. A bracket-4 Archidekt primer pairs it with Confessor, which gains a life whenever any player discards. Each Skirge Familiar activation then discards a card for a black mana, gains one life, and Niv turns that life back into the replacement draw: life neutral, hand neutral, one mana ahead. Discarding Kozilek shuffles the graveyard back, so the library never empties. A second builder deliberately avoids the instant-kill loops and runs the same commander as a bracket-2 lifegain draw engine, and Commander Spellbook already registers two-card infinite draw with Sheoldred.",
    "source": {
      "name": "Niv-Spirret",
      "type": "decklist",
      "url": "https://archidekt.com/decks/26575861",
      "creator": "amber-card-addict",
      "resourceDepth": "primer"
    },
    "publishedAt": "2026-09-22",
    "observedAt": "2026-09-24T07:40:00.000Z",
    "commanders": [
      { "name": "Niv-Mizzet, Ghost Counsel", "slug": "niv-mizzet-ghost-counsel" }
    ],
    "cards": [
      { "name": "Confessor", "slug": "confessor" },
      { "name": "Skirge Familiar", "slug": "skirge-familiar" },
      { "name": "Kozilek, Butcher of Truth", "slug": "kozilek-butcher-of-truth" },
      { "name": "Sheoldred, the Apocalypse", "slug": "sheoldred-the-apocalypse" },
      { "name": "Mana Tithe", "slug": "mana-tithe" }
    ],
    "evidence": {
      "strength": 0.74,
      "independentSourceCount": 2,
      "conversationDepth": "reasoned",
      "communityReasoned": true,
      "tested": false,
      "notes": [
        "The primer states the loop mechanically - discard outlet into the lifegain trigger into the draw - rather than naming the commander as a set-review highlight.",
        "The pieces are old and cheap: Confessor is an Odyssey common and Skirge Familiar a Modern Horizons 2 uncommon, so the line does not depend on Reality Fracture cards.",
        "The same lifegain-on-discard shape is already registered on Commander Spellbook with Oloro in the Niv slot, which is independent support for the mechanism.",
        "Two builders reached different shells on purpose - a bracket-4 control-into-combo list and a bracket-2 engine that skips the instant kills - so the commander has room in it rather than one line.",
        "Neither builder reports games played, so this is reasoned rather than tested."
      ],
      "corroboratingSources": [
        {
          "name": "Niv-Mizzet, Ghost Counsel: Parun-Normal Activity",
          "url": "https://archidekt.com/decks/26511556",
          "creator": "MTGDeckVault"
        },
        {
          "name": "Commander Spellbook: Niv-Mizzet, Ghost Counsel with Sheoldred, the Apocalypse",
          "url": "https://commanderspellbook.com/combo/2498-8192/",
          "creator": "Commander Spellbook"
        }
      ],
      "alternatives": [
        {
          "name": "Confessor plus a free discard outlet",
          "status": "supporting",
          "reason": "Confessor triggers on any player discarding, so a repeatable outlet converts the commander's life-for-cards clause into a mana engine that costs nothing."
        },
        {
          "name": "Kozilek, Butcher of Truth as the fuel tank",
          "status": "supporting",
          "reason": "Being put into the graveyard from anywhere shuffles the graveyard into the library, so discarding it refills the deck the loop is drawing through."
        },
        {
          "name": "Sanguine Bond style symmetric lifegain kills",
          "status": "rejected",
          "reason": "The second builder cut them on purpose, because the drain loops end the game before the draw engine does anything and make the commander interchangeable."
        }
      ]
    },
    "tags": [
      "ci-wb",
      "arch-combo",
      "arch-lifegain",
      "mech-lifegain-triggers",
      "mech-discard-outlet",
      "band-1000-2000",
      "recheck-30d"
    ],
    "popularity": {
      "edhrecRank": 1587,
      "deckCount": 1090,
      "asOf": "2026-09-22"
    }
  },
  {
    "id": "the-queen-of-dale-soldiers-as-resources-2026-09-24",
    "findingType": "deep_dive_resource",
    "title": "Two Queen of Dale builds disagree on whether the Soldiers are a board or ramp",
    "summary": "The Queen of Dale recruits on each opponent's first noncreature spell each turn, which hands mono-white a repeatable discard outlet it normally has no access to. An EDHREC deck tech spends the triggers binning oversized Angels for Restoration Seminar and Emeria, and plays the Human Soldier tokens as a board to anthem and convoke. An unrelated Archidekt primer keeps the reanimator half and spends the same tokens as resources instead: Ashnod's Altar converts them to mana for the expensive value spells, and Settle the Wreckage aimed at his own attack exiles them for basic Plains, which is what turns Emeria on.",
    "source": {
      "name": "The Queen of Dale | A Mono-White Reanimator Deck",
      "type": "article",
      "url": "https://edhrec.com/articles/the-queen-of-dale-a-mono-white-reanimator-deck",
      "creator": "Brian Cain",
      "resourceDepth": "deep_dive"
    },
    "publishedAt": "2026-08-03",
    "observedAt": "2026-09-24T07:45:00.000Z",
    "commanders": [
      { "name": "The Queen of Dale", "slug": "the-queen-of-dale" }
    ],
    "cards": [
      { "name": "Restoration Seminar", "slug": "restoration-seminar" },
      { "name": "Emeria, the Sky Ruin", "slug": "emeria-the-sky-ruin" },
      { "name": "Ashnod's Altar", "slug": "ashnods-altar" },
      { "name": "Settle the Wreckage", "slug": "settle-the-wreckage" },
      { "name": "Blasting Station", "slug": "blasting-station" },
      { "name": "Moonshaker Cavalry", "slug": "moonshaker-cavalry" }
    ],
    "evidence": {
      "strength": 0.68,
      "independentSourceCount": 2,
      "conversationDepth": "reasoned",
      "communityReasoned": true,
      "tested": false,
      "notes": [
        "The article walks the trigger's wording out as a worked example - one trigger per opponent per turn, counterspells on other players' turns included - rather than asserting that the commander draws cards.",
        "Settle the Wreckage pointed at your own attacking tokens is the non-obvious half: it exiles them and fetches that many basic Plains, so a wide board converts into the land count Emeria wants.",
        "The two reads diverge on the same question and neither is a variation of the other: tokens as an attacking board with anthems and Divine Visitation, against tokens as altar fodder and ramp.",
        "Caveat for review: this commander has broad coverage for its rank and has been called a staple elsewhere, so the novelty is in the resource reading, not in the commander.",
        "Neither source reports games played."
      ],
      "corroboratingSources": [
        {
          "name": "Reanimator? I hardly know 'er!",
          "url": "https://archidekt.com/decks/25210724",
          "creator": "Devitar"
        }
      ],
      "alternatives": [
        {
          "name": "Soldiers as altar fodder and ramp",
          "status": "supporting",
          "reason": "Ashnod's Altar turns a token into mana the turn it arrives, and Settle the Wreckage converts the rest of the board into basic Plains for Emeria."
        },
        {
          "name": "Soldiers as an attacking board",
          "status": "supporting",
          "reason": "Anthems, convoke outlets and Moonshaker Cavalry make the same tokens a clock, which is the reading the article builds toward."
        },
        {
          "name": "Treating recruit as pure card draw",
          "status": "rejected",
          "reason": "Recruit draws then discards, so it is filtering rather than advantage; the value comes from what the discard puts in the graveyard and what the token is then spent on."
        }
      ]
    },
    "tags": [
      "ci-w",
      "arch-reanimator",
      "arch-tokens",
      "mech-recruit",
      "mech-discard-outlet",
      "band-1000-2000",
      "recheck-90d"
    ],
    "popularity": {
      "edhrecRank": 1644,
      "deckCount": 1014,
      "asOf": "2026-09-22"
    }
  }
]
